длительность посещения ;Длительность посещения ;время одного посещения пользователем вашего сайта. Обычно рассчитывается как разница между временем последней активности пользователя на сайте и временем его первого действия.;https://webpromoexperts.com.ua/blog/36-terminov-internet-marketinga/;Visit Duration 
доверие ;Доверие ;степень уверенности получателя информации в том, что ее источник правдив или достоверен.;http://infosystems.ru/library/slovar_ais_1218/slovar_marketin_1221.html;Credibility 
доверительный интервал ;Доверительный интервал ;диапазон, охватывающий определенный процент всех ответов респондентов на конкретный вопрос, как правило– 95 или 99%.;http://infosystems.ru/library/slovar_ais_1218/slovar_marketin_1221.html;Confidence band 
домашний магазин ;Домашний магазин ;способ совершения покупок потребителем, не выходя из дома посредством почты, телефона, Интернета и др.;http://infosystems.ru/library/slovar_ais_1218/slovar_marketin_1221.html;Home shopping 
домохозяйство ;Домохозяйство ;семья или группа людей, проживающих вместе и ведущих совместное хозяйство.;http://infosystems.ru/library/slovar_ais_1218/slovar_marketin_1221.html;Household 
доход ;Доход ;любой приток денежных средств или получение материальных ценностей, обладающих денежной стоимостью.;http://infosystems.ru/library/slovar_ais_1218/slovar_marketin_1221.html;Income, revenue 
доход валовый ;Доход валовый ;денежное выражение исчисленного суммарного годового дохода предприятия, компании, полученный в результате производства и продажи продукции.;http://infosystems.ru/library/slovar_ais_1218/slovar_marketin_1221.html;Gross profit 
доход располагаемый ;Доход располагаемый ;денежные средства, которые остаются у потребителя после уплаты налогов и используются для приобретения продуктов питания, одежды, оплаты жилья.;http://infosystems.ru/library/slovar_ais_1218/slovar_marketin_1221.html;Disposable income 
дуополия ;Дуополия ;рынок, на котором существуют только два производителя или продавца данного товара и множество покупателей. Это вид несовершенной конкуренции на практике компаниям приносит меньше прибыли, чем если бы они в результате слияния образовали монополию.;http://infosystems.ru/library/slovar_ais_1218/slovar_marketin_1221.html;duopoly 
еда быстрого приготовления ;Еда быстрого приготовления ;концепция ресторанов, где предлагается еда, со стандартным выбором, сервисом и блюд. Например, МакДональдс, Ростикс, Пицца Хат.;http://infosystems.ru/library/slovar_ais_1218/slovar_marketin_1221.html;Fast food 
жалон;Жалон;рекламный носитель из картона или пластика, выполненный в форме продвигаемого товара.;https://kaplunoff.com/blog/marketing-i-prodazhi/237-marketing-words;
жизненный цикл домохозяйства ;Жизненный цикл домохозяйства ;ряд состояний, через которые проходит домохозяйство с течением времени и связанные с этим перемены.;http://infosystems.ru/library/slovar_ais_1218/slovar_marketin_1221.html;Household life cycle 
заведующий отделом рекламы ;Заведующий отделом рекламы ;руководитель отдела или подразделения рекламы в компании, несущий ответственность за рассмотрение планов и бюджета рекламной деятельности.;http://infosystems.ru/library/slovar_ais_1218/slovar_marketin_1221.html;Advertising manager 
заинтересованность, вовлеченность ;Заинтересованность, вовлеченность ;сильная мотивация в определенной ситуации, где какой-либо стимул оказывается для индивида очень важным.;http://infosystems.ru/library/slovar_ais_1218/slovar_marketin_1221.html;Involvement 
заключение сделки ;Заключение сделки ;этап процесса личной продажи, который включает в себя получение от потенциального покупателя обязательства совершить покупку.;http://infosystems.ru/library/slovar_ais_1218/slovar_marketin_1221.html;Closing stage 
закон предложения ;Закон предложения ;при прочих равных условиях объем предложения товара возрастает при увеличении его цены.;http://infosystems.ru/library/slovar_ais_1218/slovar_marketin_1221.html;Law of supply 
закон спроса ;Закон спроса ;при прочих равных условиях рост цены товара означает уменьшение предъявляемого объема спроса.;http://infosystems.ru/library/slovar_ais_1218/slovar_marketin_1221.html;Law of demand 
закон спроса и предложения ;Закон спроса и предложения ;цена любого товара изменяется для приведения спроса и предложения на этот товар в состояние равновесия.;http://infosystems.ru/library/slovar_ais_1218/slovar_marketin_1221.html;Law of demand and supply 
закупки организаций ;Закупки организаций ;это процесс принятия решений, в ходе которого организация определяет необходимость приобретения товаров и услуг: выявляя, оценивая и отбирая для закупки конкретные марки товаров и поставщиков.;http://infosystems.ru/library/slovar_ais_1218/slovar_marketin_1221.html;Corporate purchasing 
закупочный центр ;Закупочный центр ;группа сотрудников внутри организации, которые отвечают за принятие решений о размещении заказов и закупках товаров и услуг (чаще, товаров производственного назначения).;http://infosystems.ru/library/slovar_ais_1218/slovar_marketin_1221.html;Buying center 
запасы ;Запасы ;материалы, которые могут быть переработаны или сразу проданы покупателям, включая продукцию, произведенную компанией и готовую к продаже.;http://infosystems.ru/library/slovar_ais_1218/slovar_marketin_1221.html;Inventory 
запоминание ;Запоминание ;закрепление информации в долговременной памяти человека для последующего ее использования.;http://infosystems.ru/library/slovar_ais_1218/slovar_marketin_1221.html;Retention 
запрос ;Запрос ;потребность в приобретении товаров, подкрепленная покупательской способностью индивида.;http://infosystems.ru/library/slovar_ais_1218/slovar_marketin_1221.html;Demand 
зеркальная самооценка-зеркальное «я» ;Зеркальная самооценка-зеркальное «я» ;процесс прогнозирования потребителем реакции других людей на его поведение и внешний облик.;http://infosystems.ru/library/slovar_ais_1218/slovar_marketin_1221.html;Looking-glass self 
знак ;Знак ;образ, посредством которого обозначается целевое содержание объекта.;http://infosystems.ru/library/slovar_ais_1218/slovar_marketin_1221.html;Sign 
знание/когнитивный компонент ;Знание/когнитивный компонент ;информация, которую имеет потребитель относительно того или иного товара.;http://infosystems.ru/library/slovar_ais_1218/slovar_marketin_1221.html;Knowledge/Cognitive component 
знаток рынка ;Знаток рынка ;авторитетный человек, который может выступить в качестве источника информации о событиях и процессах, происходящих на каком-либо потребительском рынке.;http://infosystems.ru/library/slovar_ais_1218/slovar_marketin_1221.html;Market maven 
идеальный продукт ;Идеальный продукт ;продукт, который респондент предпочитает всем другим, включая те, которые он знает.;http://infosystems.ru/library/slovar_ais_1218/slovar_marketin_1221.html;Ideal product 
идентификация ;Идентификация ;распознавание, установление тождества товаров и услуг или самой компании покупателем по совокупности определяющих их признаков.;http://infosystems.ru/library/slovar_ais_1218/slovar_marketin_1221.html;Identification 
идентичность ;Идентичность ;понятие, обозначающее осознание личностью себя, а также того, кем он является для других. Идентичность всегда предполагает как сходство с другими, так и отличие от них.;http://infosystems.ru/library/slovar_ais_1218/slovar_marketin_1221.html;Identification 
идея ;Идея ;платформа, на основании которой покупатель определяет приобретение тех или иных благ.;http://infosystems.ru/library/slovar_ais_1218/slovar_marketin_1221.html;Idea, Notion 
иерархия воздействий ;Иерархия воздействий ;последовательность этапов, через которые проходит потенциальный покупатель от первоначальной осведомленности о товаре до конечного действия, покупки (пробы или принятия товара). Этапы включают в себя: осведомленность, интерес, оценку, пробу и принятие.;http://infosystems.ru/library/slovar_ais_1218/slovar_marketin_1221.html;Hierarchy of effects 
издержки ;Издержки ;совокупные затраты предприятия, связанные с производством продукции и доведением товара до потребителей.;http://infosystems.ru/library/slovar_ais_1218/slovar_marketin_1221.html;Costs 
издержки торговые ;Издержки торговые ;расходы, связанные с продажей товаров или услуг. Включают в себя: расходы на рекламу, послепродажное обслуживание, мероприятия по стимулированию сбыта, а также зарплату и комиссионные выплаты.;http://infosystems.ru/library/slovar_ais_1218/slovar_marketin_1221.html;Selling costs 
изучение аудитории ;Изучение аудитории ;исследование с целью установления показателей читаемости, посещаемости и распространенности рекламной информации.;http://infosystems.ru/library/slovar_ais_1218/slovar_marketin_1221.html;Audience research 
изучение общественного мнения ;Изучение общественного мнения ;сбор первичной информации по насущным проблемам со слов опрашиваемых.;http://infosystems.ru/library/slovar_ais_1218/slovar_marketin_1221.html;public opinion research 
имидж ;Имидж ;эмоционально окрашенный образ чего-либо, кого-либо. Он формируется и закрепляется в массовом сознании, приобретая характер стереотипа.;http://infosystems.ru/library/slovar_ais_1218/slovar_marketin_1221.html;Image 
имидж компании ;Имидж компании ;устойчивые представление, которое компания создает о себе с помощью рекламы, формируя благоприятное представление у целевой аудитории. Это устойчивое представление потребителей, клиентов, партнеров и общественности о престиже компании, качестве её товаров и услуг, репутации руководителей.;http://infosystems.ru/library/slovar_ais_1218/slovar_marketin_1221.html;Corporate image 
имиджмейкер ;Имиджмейкер ;специалист по созданию имиджей организаций, пропагандистских кампаний и рекламы по заданию заказчика.;http://infosystems.ru/library/slovar_ais_1218/slovar_marketin_1221.html;Imagemaker 
индекс ;Индекс ;величина, сведенная к единой мере.;http://infosystems.ru/library/slovar_ais_1218/slovar_marketin_1221.html;Index 
индекс потребительских цен ;Индекс потребительских цен ;относительный показатель динамики стоимости потребительской корзины, потребительских товаров и услуг: продовольственных товаров, жилья, промышленных товаров массового потребления, топлива и энергии. Рассчитывается ежемесячно по отношению к предыдущему месяцу.;http://infosystems.ru/library/slovar_ais_1218/slovar_marketin_1221.html;Consumer price index 
индекс розничной торговли компании а.с.nielsen ;Индекс розничной торговли компании А.С.Nielsen ;результаты аудита продаж розничных магазинов, проводимые компанией A.C.Nielsen по четырем крупным группам магазинов: магазины продовольственных товаров, аптеки, алкогольных напитков и магазины товаров широкого спроса.;http://infosystems.ru/library/slovar_ais_1218/slovar_marketin_1221.html;Nielsen retail index 
инновация ;Инновация ;товар или стиль, который воспринимается потребителями как нечто новое.;http://infosystems.ru/library/slovar_ais_1218/slovar_marketin_1221.html;Innovation 
инсайт;Инсайт;озарение, которое мотивирует на новые прогрессивные решения.;https://kaplunoff.com/blog/marketing-i-prodazhi/237-marketing-words;
инструменты стимулирования сбыта ;Инструменты стимулирования сбыта ;средства поощрения потребителей с целью совершения ими покупки: раздача бесплатных образцов товара, купоны, скидки, премии, призы, вознаграждения, бесплатные пробы, гарантии. К ним также относятся средства стимулирования торговли: снижение закупочных цен, компенсации за рекламу и средства стимулирования деловых партнеров: торговые выставки, конференции, сувенирная реклама.;http://infosystems.ru/library/slovar_ais_1218/slovar_marketin_1221.html;Sales promotion tools 
интегрированные маркетинговые коммуникации ;Интегрированные маркетинговые коммуникации ;концепция координации всех каналов коммуникации в комплексе (реклама в СМИ, личные продажи, стимулирование сбыта, связи с общественностью, прямой маркетинг, упаковка и др.). По принципу «из всех стволов» для продвижения компании или ее продукции на рынок.;http://infosystems.ru/library/slovar_ais_1218/slovar_marketin_1221.html;Integrated marketing communication 
интенсивность ;Интенсивность ;частота и объем покупок, совершаемых определенной группой потребителей.;http://infosystems.ru/library/slovar_ais_1218/slovar_marketin_1221.html;Consumption rate 
интервью ;Интервью ;исследовательская техника, используемая при сборе маркетинговой информации. Посредством интервью собираются как количественные, так и качественные данные о потребителях.;http://infosystems.ru/library/slovar_ais_1218/slovar_marketin_1221.html;Interview 
интервью в торговом центре ;Интервью в торговом центре ;интервьюирование на месте торговли с целью получения оценки конкретного товара и стимулирования продаж.;http://infosystems.ru/library/slovar_ais_1218/slovar_marketin_1221.html;mall intercept 
интервью личное ;Интервью личное ;метод исследования рынка путем сбора информации в процессе личного контакта (опроса, беседы) интервьюера с респондентами.;http://infosystems.ru/library/slovar_ais_1218/slovar_marketin_1221.html;Personal interview 
интервью на дому ;Интервью на дому ;опрос, который проводится у респондентов на дому.;http://infosystems.ru/library/slovar_ais_1218/slovar_marketin_1221.html;Door-to-door interview 
интервью неструктурированное ;Интервью неструктурированное ;тип индивидуальных глубинных интервью, при которых респонденту предоставляется максимальная свобода ответов в рамках тем, интересующих интервьюера.;http://infosystems.ru/library/slovar_ais_1218/slovar_marketin_1221.html;Nondirective interview 
интервью онлайновые ;Интервью онлайновые ;интервью, при котором интервьюер зачитывает вопросы непосредственно с экрана компьютера или заносит их в компьютер при помощи клавиатуры.;http://infosystems.ru/library/slovar_ais_1218/slovar_marketin_1221.html;On-line interview 
интервью полуструктурированное/направленное индивидуальное ;Интервью полуструктурированное/направленное индивидуальное ;тип индивидуального глубинного интервью, в ходе которого интервьюер стремится обсудить с респондентом конкретный список тем.;http://infosystems.ru/library/slovar_ais_1218/slovar_marketin_1221.html;Semistructured/focused individual Interview 
интервью структурированное ;Интервью структурированное ;тип индивидуальных глубинных интервью, во время которого интервьюер задает вопросы так, как они сформулированы в анкете, ничего не добавляя и не разъясняя респонденту. На вопросы возможны только три ответа: «да», «нет», «не знаю».;http://infosystems.ru/library/slovar_ais_1218/slovar_marketin_1221.html;Structured interview 
интервьюер ;Интервьюер ;участник исследования, задающий вопросы.;http://infosystems.ru/library/slovar_ais_1218/slovar_marketin_1221.html;Interviewer 
интернет ;Интернет ;глобальная компьютерная сеть, благодаря которой пользователи могут получать и отправлять информацию, общаться между собой, совершать покупки, делать предложения, изучать спрос и проводить исследования предпочтений и запросов потребителей.;http://infosystems.ru/library/slovar_ais_1218/slovar_marketin_1221.html;Internet 
интернет-сообщество, виртуальное потребительское ;Интернет-сообщество, виртуальное потребительское ;совокупность людей, которые общаются между собой через Интернет на базе общности интересов в плане получения информации о тех или иных конкретных аспектах процесса приобретения.;http://infosystems.ru/library/slovar_ais_1218/slovar_marketin_1221.html;Virtual community of consumption 
интерфейс;Интерфейс;отображение минимально необходимой для выполнения пользователем очередного шага информации. Размещение элементов управления (кнопок, модулей, блоков, текста) на экране с учетом их смыслового значения, логической взаимосвязи и ценности для пользователя в конкретный момент времени. Проектируется для упрощения ориентации посетителей сайта в информационном пространстве.;https://webpromoexperts.com.ua/blog/36-terminov-internet-marketinga/;
информационная логистическая система ;Информационная логистическая система ;определенным образом организованная совокупность взаимосвязанных средств вычислительной техники, различных справочников и необходимых средств программирования, обеспечивающая решение тех или иных задач по управлению движением материальных потоков.;http://infosystems.ru/library/slovar_ais_1218/slovar_marketin_1221.html;Information logistics system 
информация ;Информация ;сведения о лицах, предметах, фактах, событиях, явлениях и процессах, передаваемых людьми друг другу устным, письменным или другим способом.;http://infosystems.ru/library/slovar_ais_1218/slovar_marketin_1221.html;information 
