сделка, транзакция ;Сделка, транзакция ;процесс обмена, осуществляемый с единственной целью или для достижения определенного конечного результата, например операция покупки.;http://infosystems.ru/library/slovar_ais_1218/slovar_marketin_1221.html;Transaction 
сегмент деловой ;Сегмент деловой ;профессиональные потребители, покупающие определенный товар, чтобы использовать его в своем бизнесе или для производства товаров.;http://infosystems.ru/library/slovar_ais_1218/slovar_marketin_1221.html;business segment 
сегмент рынка ;Сегмент рынка ;это крупная, четко определенная группа покупателей внутри рынка со сходными потребностями и характеристиками, отличными от других групп целевого рынка.;http://infosystems.ru/library/slovar_ais_1218/slovar_marketin_1221.html;Market segment 
сегмент целевого рынок ;Сегмент целевого рынок ;группа потребителей со схожими потребностями, которые можно выявить и удовлетворить с помощью определенного товара или товарного ассортимента.;http://infosystems.ru/library/slovar_ais_1218/slovar_marketin_1221.html;Target market, segment 
сегментирование географическое ;Сегментирование географическое ;анализ географических различий с помощью таких понятий как регион, площадь и плотность населения.;http://infosystems.ru/library/slovar_ais_1218/slovar_marketin_1221.html;Geographic segmentation 
сегментирование демографическое ;Сегментирование демографическое ;стратегия рыночной сегментации, при которой предполагаемая аудитория потребителей для данной продукции разделяется на категории (сегменты) по демографическим признакам (пол, возраст).;http://infosystems.ru/library/slovar_ais_1218/slovar_marketin_1221.html;Demographic segmentation 
сегментирование дифференцированное ;Сегментирование дифференцированное ;стратегия, при которой предложения товаров дифференцировано с учетом удовлетворения потребностей определенных сегментов рынка (кастомизация).;http://infosystems.ru/library/slovar_ais_1218/slovar_marketin_1221.html;Differentiated segmentation 
сегментирование концентрированное или стратегия рыночной ниши ;Сегментирование концентрированное или стратегия рыночной ниши ;стратегия, при которой единственный товар ориентируют на единственный сегмент рынка.;http://infosystems.ru/library/slovar_ais_1218/slovar_marketin_1221.html;Concentrated segmentation 
сегментирование на основе выгод ;Сегментирование на основе выгод ;вид сегментирования рынка на базе выгод, которые люди стремятся получить от продукта.;http://infosystems.ru/library/slovar_ais_1218/slovar_marketin_1221.html;Benefit segmentation 
сегментирование поведенческое ;Сегментирование поведенческое ;деление групп потребителей на основе различий в их поведении, например, пользователи товара– не пользователи товара, регулярные потребители– случайные потребители. Сегменты рынка, в этих случаях, определяются исходя из поступков потребителей.;http://infosystems.ru/library/slovar_ais_1218/slovar_marketin_1221.html;Behavioral segmentation 
сегментирование психографическое ;Сегментирование психографическое ;разделение целевой аудитории для данной продукции на группы в соответствие с их индивидуальными характеристиками: стилем жизни, разделяемыми ценностями, убеждением, важностью в отношении к покупкам тех или иных товаров и др. Психографическая информация собирается с помощью индивидуальных интервью, анкетных опросов и др.;http://infosystems.ru/library/slovar_ais_1218/slovar_marketin_1221.html;Psychographic segmentation 
сегментирование рынка ;Сегментирование рынка ;деление потребителей на сходные группы в соответствии с географическими (место покупки), демографическими (возраст, доход, род занятий) и психографическими (мотивы покупки, стиль жизни) критериями в отношении ими покупки продукта, его цены, системы распределения и соответствующих стимулов приобретения.;http://infosystems.ru/library/slovar_ais_1218/slovar_marketin_1221.html;Market segmentation 
сегментирование рынка по возрастам и стилю жизни потребителей ;Сегментирование рынка по возрастам и стилю жизни потребителей ;разновидность сегментации рынка по возрастам потребителей, разделяемых на четыре группы: 1) дети 2) молодые люди 3)взрослые 4) пожилые. Эта концепция исходит из того, что потребности и желания потребителей изменяются по мере перехода людей из одной возрастной группы в другую.;http://infosystems.ru/library/slovar_ais_1218/slovar_marketin_1221.html;Age & Life-cycle segmentation 
сейлз-промоушн ;Сейлз-промоушн ;продвижение, стимулирование сбыта, товаров и услуг посредством маркетинговых инструментов.;http://infosystems.ru/library/slovar_ais_1218/slovar_marketin_1221.html;Sales promotion, sale-продажа, promotion-продвижение 
семья ;Семья ;группа из двух или более лиц, связанных отношениями родства, брака или совместного проживания.;http://infosystems.ru/library/slovar_ais_1218/slovar_marketin_1221.html;Family 
семья как ядро ;Семья как ядро ;собственно семья: живущие вместе отец, мать и дети.;http://infosystems.ru/library/slovar_ais_1218/slovar_marketin_1221.html;Nuclear family 
семья, жизненный цикл ;Семья, жизненный цикл ;семейные группы, с присущими им специфическими потребностями, интересами и стилями потребления. В соответствии с демографическими данными выделяют шесть групп семей: 1) молодые одинокие люди 2) молодые бездетные пары 3) молодые пары с маленьким ребенком до шести лет 4) пары с детьми-иждивенцами 5) немолодые пары, дети которых покинули семью 6) немолодые одинокие люди.;http://infosystems.ru/library/slovar_ais_1218/slovar_marketin_1221.html;Family life cycle 
семья, лицо, ответственное за принятие финансовых решений ;Семья, лицо, ответственное за принятие финансовых решений ;член семьи, на которого возложена ответственность за принятие и реализацию экономических решений, затрагивающих благосостояние семьи.;http://infosystems.ru/library/slovar_ais_1218/slovar_marketin_1221.html;FFO-Family Financial Officer 
сенсетивный маркетинг;Сенсетивный маркетинг;маркетинг, который воздействует не только на визуальное восприятие информации. Здесь подключаются другие органы чувств — обоняние, осязание, вкусовые рецепторы и т.д.;https://kaplunoff.com/blog/marketing-i-prodazhi/237-marketing-words;
сигнал ;Сигнал ;знак, физический процесс (или явление), несущий информацию о каком-либо событии или состоянии объекта;http://infosystems.ru/library/slovar_ais_1218/slovar_marketin_1221.html;sign 
сила информационного воздействия ;Сила информационного воздействия ;способность потребителя, обладающего эксклюзивной информацией, оказывать влияние на принятие другими потребителями решения о покупке.;http://infosystems.ru/library/slovar_ais_1218/slovar_marketin_1221.html;Information power 
символы статуса ;Символы статуса ;товары, которые потребители приобретают и демонстрируют в качестве признаков принадлежности к соответствующему социальному классу.;http://infosystems.ru/library/slovar_ais_1218/slovar_marketin_1221.html;Status symbols 
система поддержки маркетинговых решений ;Система поддержки маркетинговых решений ;маркетинговая информация, собранная из различных источников и организована в одной базе данных таким образом, чтобы обеспечивать возможность принятия оперативного решения.;http://infosystems.ru/library/slovar_ais_1218/slovar_marketin_1221.html;Marketing decision support system 
скидки ;Скидки ;средство стимулирования торговли, заключающееся в предоставлении возможности оптовым и розничным продавцам/потребителям в течение определенного периода времени приобретать товар по более низким (по сравнению с рыночными) ценам. В практике применяются около 40 видов ценовых скидок. Общий уровень скидок от начальной цены может достигать 50-60%.;http://infosystems.ru/library/slovar_ais_1218/slovar_marketin_1221.html;Discount, price off 
скидки благотворительные ;Скидки благотворительные ;снижение цен на продукцию, предназначенную для специальных групп потребителей с низкими доходами.;http://infosystems.ru/library/slovar_ais_1218/slovar_marketin_1221.html;Charity discounts 
скидки бонусные ;Скидки бонусные ;премиальное снижение цен на товары постоянным покупателям за повторные закупки товаров определенными партиями (до 7-10%).;http://infosystems.ru/library/slovar_ais_1218/slovar_marketin_1221.html;Bonus discounts 
скидки внутренние ;Скидки внутренние ;снижение цен на товары для работников компании, производителя, продавца.;http://infosystems.ru/library/slovar_ais_1218/slovar_marketin_1221.html;Employee discounts 
скидки вынужденные ;Скидки вынужденные ;практика использования скидок, связанная с необходимостью снижения затрат на складирование, хранение и транспортировку готовой продукции.;http://infosystems.ru/library/slovar_ais_1218/slovar_marketin_1221.html;Forced discounts 
скидки за количество закупаемого товара ;Скидки за количество закупаемого товара ;снижение цены покупателям, закупающим товар в больших количествах (до 15-20%).;http://infosystems.ru/library/slovar_ais_1218/slovar_marketin_1221.html;Quantity discounts 
скидки за платеж наличными ;Скидки за платеж наличными ;снижение цены покупателям, оперативно оплачивающим счета наличными деньгами (до 3-5%).;http://infosystems.ru/library/slovar_ais_1218/slovar_marketin_1221.html;Сash discounts 
скидки за покупку нового товара ;Скидки за покупку нового товара ;снижение цены покупателям при условии сдачи старого товара.;http://infosystems.ru/library/slovar_ais_1218/slovar_marketin_1221.html;Trade in allowances 
скидки накопительные ;Скидки накопительные ;скидки, предоставляемые покупателю при повторных покупках товара (услуги) в течение определенного периода времени.;http://infosystems.ru/library/slovar_ais_1218/slovar_marketin_1221.html;Cumulative quantity discounts 
скидки праздничные ;Скидки праздничные ;снижение цен на продаваемые товары и услуги в период праздников, знаменательных событий.;http://infosystems.ru/library/slovar_ais_1218/slovar_marketin_1221.html;Holiday discounts 
скидки с цены для вознаграждения дилеров ;Скидки с цены для вознаграждения дилеров ;метод стимулирования продавцов за участие в программах рекламы и сбыта (до 4-5%).;http://infosystems.ru/library/slovar_ais_1218/slovar_marketin_1221.html;Promotional allowances 
скидки сезонные ;Скидки сезонные ;скидки для покупателей, совершающих внесезонные покупки (до 50-70%).;http://infosystems.ru/library/slovar_ais_1218/slovar_marketin_1221.html;Seasonal discounts 
скидки специальные ;Скидки специальные ;скидки предоставляемые потребителям в целях сохранения хороших с нимиотношений, в которых заинтересованы производители/продавцы (до 5%).;http://infosystems.ru/library/slovar_ais_1218/slovar_marketin_1221.html;Special discounts 
скидки функциональные ;Скидки функциональные ;снижение цены для организаций, входящих в систему товародвижения, выполняющих определенные функции по продаже товара, его хранению и др. (до 5-7%).;http://infosystems.ru/library/slovar_ais_1218/slovar_marketin_1221.html;Functional discounts or trade discount 
скидки целевые ;Скидки целевые ;метод стимулирования продаж, посредством последовательного понижения цен до запланированного (целевого) уровня, при котором прогнозируется максимальный объем продаж.;http://infosystems.ru/library/slovar_ais_1218/slovar_marketin_1221.html;Target discounts 
скиминг;Скиминг;установление заведомо высокой цены на новый выпускаемый товар.;https://kaplunoff.com/blog/marketing-i-prodazhi/237-marketing-words;
складирование ;Складирование ;хранение товаров на складе.;http://infosystems.ru/library/slovar_ais_1218/slovar_marketin_1221.html;Warehousing 
скорость забывания ;Скорость забывания ;скорость, с которой покупатели забывают марку, если не видят ее рекламу.;http://infosystems.ru/library/slovar_ais_1218/slovar_marketin_1221.html;Forgetting rate 
слоган ;Слоган ;лозунг, призыв, девиз, используемый в виде заголовка рекламного текста в форме краткой, динамичной, эмоционально заряженной фразы. Как правило, он выражает основные идеи рекламного обращения и состоит не более чем из 6-8 слов.;http://infosystems.ru/library/slovar_ais_1218/slovar_marketin_1221.html;Slogan 
служба маркетинга ;Служба маркетинга ;специализированная служба, обеспечивающая реализацию маркетинговой деятельности в тесном взаимодействии с другими функциональными подразделениями компании.;http://infosystems.ru/library/slovar_ais_1218/slovar_marketin_1221.html;Marketing service 
служба сбыта по территориальному принципу ;Служба сбыта по территориальному принципу ;организация службы сбыта, при которой каждый торговый агент закрепляется за определенным географическим регионом, где он представляет свою компанию.;http://infosystems.ru/library/slovar_ais_1218/slovar_marketin_1221.html;Territorial sales organization 
служба сбыта, ориентированная на потребителей ;Служба сбыта, ориентированная на потребителей ;организация службы сбыта, при которой каждый торговый агент специализируется на продажи только для определенной категории клиентов (сегмента) или только для одной конкретной отрасли.;http://infosystems.ru/library/slovar_ais_1218/slovar_marketin_1221.html;Customer-oriented sales structure 
служба сбыта, товарно-ориентированная структура ;Служба сбыта, товарно-ориентированная структура ;организация службы сбыта, при которой каждый торговый агент специализируется на продаже только некоторых из производимых его компанией видов продукции или ассортиментных групп.;http://infosystems.ru/library/slovar_ais_1218/slovar_marketin_1221.html;Product-oriented sales structure 
служба синдикативных исследований ;Служба синдикативных исследований ;организация … таких компаний, как A.C.Nielsen и Romir-Monitoring, которые обеспечивают разделение затрат на проведение крупного маркетингового исследования между фирмами-клиентами.;http://infosystems.ru/library/slovar_ais_1218/slovar_marketin_1221.html;Syndicated services 
случайный набор номера ;Случайный набор номера ;процедура, предполагающая выбор всех 10 цифр телефонного номера случайным образом, без использования справочников.;http://infosystems.ru/library/slovar_ais_1218/slovar_marketin_1221.html;Random-digit dialing 
смена поколений ;Смена поколений ;культурные изменения в обществе, предполагающие постепенное вытеснение представителями молодого поколения существующих ценностей.;http://infosystems.ru/library/slovar_ais_1218/slovar_marketin_1221.html;Generational change 
смешенная экономика ;Смешенная экономика ;экономика, в которой часть товаров и услуг производится государством, а другая часть– частными предпринимателями. Занимает промежуточное положение между командной и чистой конкуренцией. В реальной жизни большинство национальных хозяйств являются смешанными экономиками.;http://infosystems.ru/library/slovar_ais_1218/slovar_marketin_1221.html;mixed economy 
события;События;любое действие совершенное посетителем сайта, которое не приводит к перезагрузке страницы/изменению ее адреса (url), но при этом изменяет интерфейс этой страницы. Например: показ объявлений, начало и конец транзакции, изменения полей формы, запуск мультимедиа и.т.д. События также могут быть связаны и с такими веб-технологиями, как Ajax и Flash.;https://webpromoexperts.com.ua/blog/36-terminov-internet-marketinga/;
события ;События ;определенные даты, юбилеи, выставки, торговые ярмарки, спорт, художественные события. События требует специальных маркетинговых решений.;http://infosystems.ru/library/slovar_ais_1218/slovar_marketin_1221.html;Events 
сообщение, объявление ;Сообщение, объявление ;первичный элемент процесса передачи (communication) информации от коммуникатора (communicator) к получателю (receiver). Сообщение является основой любой рекламы.;http://infosystems.ru/library/slovar_ais_1218/slovar_marketin_1221.html;Message 
состоятельные люди ;Состоятельные люди ;индивидуумы, как правило, имеющие большие доходы, высокий уровень образования и профессиональный статус.;http://infosystems.ru/library/slovar_ais_1218/slovar_marketin_1221.html;Upscale 
социализация ;Социализация ;процесс усвоения индивидом культуры и главенствующих ее ценностей и символов.;http://infosystems.ru/library/slovar_ais_1218/slovar_marketin_1221.html;Socialization 
социальная мобильность ;Социальная мобильность ;переход индивида из одного социального класса в другой.;http://infosystems.ru/library/slovar_ais_1218/slovar_marketin_1221.html;Social mobility 
