метод «мозговой атаки» ;Метод «мозговой атаки» ;аналитический метод поиска маркетингового решения, где группы по 5-6 человек от 15мин. до одного часа проводят тематическое обсуждение интересующего вопроса или проблемы. Приветствуются оригинальные идеи и новые подходы. Выступления выслушиваются молча и до конца. По окончании анализируются идеи и подводятся итоги обсуждения.;http://infosystems.ru/library/slovar_ais_1218/slovar_marketin_1221.html;Brainstorming 
метод «припоминания без подсказки» ;Метод «припоминания без подсказки» ;метод проведения опросов, при котором респондентов просят вспомнить интересующий объект без содействия или подсказок со стороны исследователя.;http://infosystems.ru/library/slovar_ais_1218/slovar_marketin_1221.html;Unaided recall 
метод «припоминания на следующий день» ;Метод «припоминания на следующий день» ;тестирование представителей аудитории, от которых требуется вспомнить что-либо конкретное о рекламном ролике на следующий день после его просмотра.;http://infosystems.ru/library/slovar_ais_1218/slovar_marketin_1221.html;DAR-Day-After-Recall 
метод «припоминания с подсказкой» ;Метод «припоминания с подсказкой» ;метод проведения опроса, при котором предпринимаются попытки стимулирования памяти респондента при помощи подсказок об объекте интереса.;http://infosystems.ru/library/slovar_ais_1218/slovar_marketin_1221.html;Aided recall 
метод «расчет от наличных средств» ;Метод «расчет от наличных средств» ;форма формирования рекламного бюджета посредством выделения компанией такой суммы на продвижение товара, которую она себе может позволить.;http://infosystems.ru/library/slovar_ais_1218/slovar_marketin_1221.html;Affordable method 
метод «расчет процента от суммы продаж» ;Метод «расчет процента от суммы продаж» ;форма формирования рекламного бюджета, рассчитанная в установленном процентном отношении от текущей или прогнозируемой выручки ( как правило 2-5-7 %).;http://infosystems.ru/library/slovar_ais_1218/slovar_marketin_1221.html;Sales percentage calculation 
метод «слепое тестирование» ;Метод «слепое тестирование» ;тестирование, в ходе которого потребителей просят оценить различные продукты, не информируя их о наименованиях марок.;http://infosystems.ru/library/slovar_ais_1218/slovar_marketin_1221.html;Blind use test 
метод «ступенек» ;Метод «ступенек» ;способ последовательного раскрытия сформированных в сознании потребителя ассоциаций между отдельными свойствами продукта и общими последствиями, которые наступают в ходе их реализации.;http://infosystems.ru/library/slovar_ais_1218/slovar_marketin_1221.html;Laddering 
метод «фокус-групп» ;Метод «фокус-групп» ;метод качественных исследований, когда небольшую группу людей (6-12 чел) просят сосредоточиться (сфокусироваться) на том или ином вопросе и обсудить его с ведущим дискуссию (модератором) в формате глубинного интервью.;http://infosystems.ru/library/slovar_ais_1218/slovar_marketin_1221.html;Focus group 
метод «фэйс-ту-фэйс» ;Метод «фэйс-ту-фэйс» ;процедура опроса, при котором интервьюер задает вопросы и фиксирует ответы респондента непосредственно в ходе прямого общения. При этом анкета тут же заполняется интервьюером.;http://infosystems.ru/library/slovar_ais_1218/slovar_marketin_1221.html;Face to face, лицом к лицу 
метод «холл-тест» ;Метод «холл-тест» ;метод исследования целевой аудитории, предполагающий тестирование отдельных характеристик товаров (и/или рекламных материалов) в закрытом помещении.;http://infosystems.ru/library/slovar_ais_1218/slovar_marketin_1221.html;Hall-test 
метод «хоум-тест» ;Метод «хоум-тест» ;метод исследования, при котором респонденту предлагается протестировать какой-либо продукт или несколько продуктов в реальной домашней обстановке. Обычно это продукты повседневного использования: детское питание, шампуни, стиральные порошки и др.;http://infosystems.ru/library/slovar_ais_1218/slovar_marketin_1221.html;Home test 
метод «читательских привычек» ;Метод «читательских привычек» ;метод измерения аудитории печатных средств массовой информации, где респондентам предлагается ответить на вопросы, например, сколько номеров издания из последних четырех они читали.;http://infosystems.ru/library/slovar_ais_1218/slovar_marketin_1221.html;Reading habit 
метод в форме беседы ;Метод в форме беседы ;метод получения информации на основе диалоговой коммуникации, используется при индивидуальных опросах, интервью.;http://infosystems.ru/library/slovar_ais_1218/slovar_marketin_1221.html;Interview 
метод включенного наблюдения ;Метод включенного наблюдения ;метод сбора информации, при котором исследователь осуществляет наблюдение за определенным потребительским сегментом, выступая, при этом, его членом.;http://infosystems.ru/library/slovar_ais_1218/slovar_marketin_1221.html;Participant observation 
метод глубинного интервьюирования ;Метод глубинного интервьюирования ;индивидуальная беседа интервьюера, проводимая с респондентом по заранее разработанному сценарию (вопроснику), которая предполагает получение от респондента развернутых ответов на вопросы, а не заполнение анкеты. При этом, обычно используется магнитофонная запись.;http://infosystems.ru/library/slovar_ais_1218/slovar_marketin_1221.html;In-depth interview 
метод заключительного тестирования ;Метод заключительного тестирования ;метод, где респондентам предлагается заполнить тесты, после того как реклама была показана этой целевой аудитории, с целью определения ее воздействия.;http://infosystems.ru/library/slovar_ais_1218/slovar_marketin_1221.html;Posttests 
метод интервью он-лайн ;Метод интервью он-лайн ;один из современных методов опроса покупателей посредством размещения анкеты на сайте компании или рассылки ее по заранее намеченным электронным адресам.;http://infosystems.ru/library/slovar_ais_1218/slovar_marketin_1221.html;Online interview 
метод интроспекции ;Метод интроспекции ;метод, используемый при анализе и прогнозировании поведения рыночных субъектов (потребителей, конкурентов). Исследователь пытается поставить себя на место анализируемого субъекта, выдвигая гипотезы о его поведении, исходя из собственных представлений.;http://infosystems.ru/library/slovar_ais_1218/slovar_marketin_1221.html;Introspective method 
метод исследования в торговом центре ;Метод исследования в торговом центре ;метод предварительной проверки, который включает в себя обращение к людям, выбранным случайным образом в торговом центре, демонстрируя им различные варианты продукции с целью получения от них оценки.;http://infosystems.ru/library/slovar_ais_1218/slovar_marketin_1221.html;Mall intercept 
метод исследования розничной сети ;Метод исследования розничной сети ;метод, предполагающий обследование выбранных торговых точек (розничных и мелкооптовых) с целью изучения ассортимента и ценовых характеристик продаваемых товаров.;http://infosystems.ru/library/slovar_ais_1218/slovar_marketin_1221.html;Store checking 
метод исследования рынка «слепая» проверка ;Метод исследования рынка «слепая» проверка ;метод исследования рынка, когда потребителям предлагается оценить продукцию, не раскрывая ее, с целью выяснения потребительских предпочтений. Этот метод часто используется для сравнения нового продукта с уже признанным, занимающим на рынке прочные позиции.;http://infosystems.ru/library/slovar_ais_1218/slovar_marketin_1221.html;blind testing 
метод исследования торговых зон ;Метод исследования торговых зон ;метод сравнительного анализа частоты посещения торговой точки покупателями. Источниками информации могут выступать, например, перепись данных продаж торговой точки или зоны, подсчет количества автомобилей на стоянке перед торговой точкой.;http://infosystems.ru/library/slovar_ais_1218/slovar_marketin_1221.html;Retail audit 
метод исследования цен ;Метод исследования цен ;метод, направленный на определение такого уровня и соотношения цен, который бы позволял получить наибольшую прибыль при наименьших затратах. Наиболее известные среди них– «лестница цен» (Price Laddering), «определение чувствительности цены»(Price Sensitivity Measurement).;http://infosystems.ru/library/slovar_ais_1218/slovar_marketin_1221.html;Pricing research 
метод кабинетного исследования ;Метод кабинетного исследования ;маркетинговое исследование, проводимое на основе изучения и анализа вторичных данных-внешних публикаций и материалов, включая изучение внутренних отчетов, служебной информации компании.;http://infosystems.ru/library/slovar_ais_1218/slovar_marketin_1221.html;Desk research 
метод кейсов ;Метод кейсов ;подробное описание и анализ отдельной рыночной ситуации. Часто используется в образовательных целях, где слушателям предлагается стать соучастниками этой ситуации и найти оптимальное решение выхода.;http://infosystems.ru/library/slovar_ais_1218/slovar_marketin_1221.html;Case study 
метод контент-анализ ;Метод контент-анализ ;кабинетный метод анализа содержания коммуникации (теста, сообщения). Маркетолог-исследователь определяет четкий ряд категорий, высвечивающих исследуемую проблематику. Затем классифицирует содержание этой коммуникации в соответствии с этими категориями.;http://infosystems.ru/library/slovar_ais_1218/slovar_marketin_1221.html;Content analysis method 
метод моделирования рынка ;Метод моделирования рынка ;способ определения рыночного потенциала города, региона или страны на основе выявления всех потенциальных покупателей в отношении приобретения ими товаров производственного назначения.;http://infosystems.ru/library/slovar_ais_1218/slovar_marketin_1221.html;Market-build-up method 
метод опроса ;Метод опроса ;один из самых распространенных методов сбора данных: личное интервью, телефонное интервью, почтовый опрос или какая-либо их комбинация.;http://infosystems.ru/library/slovar_ais_1218/slovar_marketin_1221.html;Survey method 
метод опроса в момент совершения покупки ;Метод опроса в момент совершения покупки ;метод опроса потребителей, предполагающий сбор данных посредством личных интервью. Для этого проводится наблюдение покупательского поведения в магазине и последующий перехват потребителей в момент совершения покупки.;http://infosystems.ru/library/slovar_ais_1218/slovar_marketin_1221.html;PIT-Purchase Interception Technique 
метод тестирования концепции ;Метод тестирования концепции ;исследование, при котором концепция продукта оценивается выборкой из целевого потребительского сегмента.;http://infosystems.ru/library/slovar_ais_1218/slovar_marketin_1221.html;Concept test 
метод тестирования продукта ;Метод тестирования продукта ;один из способов оценки продукта, при котором продукт предоставляют пользователям и через определенный промежуток времени просят дать отзыв о нем .;http://infosystems.ru/library/slovar_ais_1218/slovar_marketin_1221.html;Use test 
метод эксперимент ;Метод эксперимент ;целенаправленное изучение отдельных параметров товара, цены, упаковки, дизайна и т.п. в целях изучения факторов, влияющих на изменение потребительских реакций и предпочтений в специально организованной группе (без предварительного согласия потребителей).;http://infosystems.ru/library/slovar_ais_1218/slovar_marketin_1221.html;Experimental 
метод, «набор по методу «плюс один» ;Метод, «набор по методу «плюс один» ;метод телефонного опроса, при котором исследователь случайно выбирает телефонные номера из одного или нескольких справочников, после чего к четырем последним цифрам каждого номера прибавляется единица.;http://infosystems.ru/library/slovar_ais_1218/slovar_marketin_1221.html;Plus-one dialing 
метод, «условное личное собеседование» ;Метод, «условное личное собеседование» ;процедура случайного выбора респондентов, с которыми договариваются об интервью по телефону или при посещении их дома либо на работе.;http://infosystems.ru/library/slovar_ais_1218/slovar_marketin_1221.html;Random individual interview 
методика capi ;Методика CAPI ;мультимедийная система персонального интервьюирования при помощи компьютера. Респондент находится за компьютерным терминалом и отвечает на вопросы анкеты, отображаемые на экране монитора, с помощью клавиатуры, мыши или сенсорного экрана.;http://infosystems.ru/library/slovar_ais_1218/slovar_marketin_1221.html;Computer Assisted Personal Interview 
методы качественных исследований ;Методы качественных исследований ;методы маркетинговых исследований, направленных на изучение убеждений, мотиваций, мнений и ощущений респондентов, где используются небольшие выборки респондентов. К этим методам относятся: глубинное интервьюирование, групповые обсуждения (фокус-группы). При этом интервьюер задает, как правило, вопросы типа: «Почему?», «Каким образом?».;http://infosystems.ru/library/slovar_ais_1218/slovar_marketin_1221.html;Qualitative marketing research 
методы количественных исследований ;Методы количественных исследований ;методы маркетинговых исследований, направленные на изучение мнений и оценок потребителей в ходе опросов. При этом в анкетах используются открытые и закрытые вопросы. Они сформулированы так, чтобы получить ответы на вопросы: «Кто?», «Что?», «Где?», «Когда?», «Как?» и «Сколько?». К таким методам относятся прежде всего массовые опросы потребителей.;http://infosystems.ru/library/slovar_ais_1218/slovar_marketin_1221.html;Quantitative methods 
микромаркетинг ;Микромаркетинг ;целенаправленные маркетинговые усилия по разработке и производству продукции, рыночных стратегий фирмы и рекламных кампаний, направленных на очень специфические географические, демографические и психографические сегменты потребительского рынка.;http://infosystems.ru/library/slovar_ais_1218/slovar_marketin_1221.html;Micromarketing 
микросреда компании ;Микросреда компании ;факторы, тесно связанные с компанией и воздействующие на ее способность обслуживать целевых клиентов. Она включает: саму компанию, посредников, поставщиков, конкурентов, целевых потребителей и контактные аудитории.;http://infosystems.ru/library/slovar_ais_1218/slovar_marketin_1221.html;Microenvironment 
миссия компания ;Миссия компания ;заявление о том, каким видом (видами) деятельности компания призвана заниматься.;http://infosystems.ru/library/slovar_ais_1218/slovar_marketin_1221.html;Corporate mission 
модератор ;Модератор ;ведущий дискуссии в фокус-группах. Должен владеть специальными знаниями и методами управления аудиторией.;http://infosystems.ru/library/slovar_ais_1218/slovar_marketin_1221.html;Moderator 
мониторинг ;Мониторинг ;система постоянного, регулярного сбора и отслеживания четко определенного объема рыночной информации: цен, запросов, ожиданий потребительских сегментов, рекламы и т.п.;http://infosystems.ru/library/slovar_ais_1218/slovar_marketin_1221.html;Monitoring 
мотив ;Мотив ;устойчивое предрасположение, направляющее покупательское поведение индивида по достижению определенной цели. Мотивы могут быть рациональными (утилитарными) или эмоциональными (гедонистическими).;http://infosystems.ru/library/slovar_ais_1218/slovar_marketin_1221.html;Motive 
мультиатрибутивная модель товара ;Мультиатрибутивная модель товара ;модель, связывающая суждения потребителей по поводу отдельных атрибутов (свойств) товаров, включая их оценку в целом (нравится– не нравится). Эта модель основана на том, что атрибуты товара потребители рассматривают и оценивают с точки зрения их основных качеств (набор функциональных характеристик) и добавленных качеств (свойства товаров, превышающих качества товаров– конкурентов).;http://infosystems.ru/library/slovar_ais_1218/slovar_marketin_1221.html;Multiattribute model product 
наблюдение ;Наблюдение ;метод сбора данных по регистрации (фиксации) интересующего исследователя поведения потребителя (прямое наблюдение, наблюдение в искусственно созданной ситуации, косвенное наблюдение, включая использование техники для записи информации о поведении покупателя).;http://infosystems.ru/library/slovar_ais_1218/slovar_marketin_1221.html;Observation 
